country,0,1,2,3,4,5,6,7,8,9
0,tea,handbooks and manuals by subject,camellia sinensis,recipe,british cuisine,chinese,cookery,recipes,cookbook,cookery book
1,types of food,edible plants,plants,species,plants and humans,fruit,cultivation,grow,plant,seeds
2,cuisine,cuisine by country,food and drink by country,cuisine by continent,dishes,dish,ingredients,preparation,culture by country,pork
3,fast food,restaurants,restaurants by type,restaurant,restaurant chain,restaurants by year of establishment,restaurants by century of establishment,restaurants by time,locations,location
4,alcohol,alcoholic beverage,alcoholic drinks,drink,fermented drinks,alcoholic drinks by country,cocktail,alcohol by volume,beer,produce
5,food product brands,brands,brands by company,food and drink companies by country,supermarket,products,brand,business,stores,company
6,nutrition,health,diet,food politics,organic compound,carbohydrate,produce,protein,vineyards,branches of biology
