country,1,2,3,4,5,6,7,8,9,10
0,Media technology,Electronics,Film and video technology,Digital media,Information and communications technology,Technology by type,Video,Imaging,Display technology,Japanese inventions
1,Media companies of the United States,Television in the United States,Establishments in the United States by year,Media companies of North America,Television broadcasting companies of the United States,Companies of the United States by industry,Media companies by country,American television networks,Entertainment companies of the United States,Media in the United States
2,Establishments by year and country,Establishments by country and year,Media by country,Media companies by year of establishment,Television stations by language,Television by year,Television by country,Establishments in Europe by year,Television stations,Establishments in Asia by year
3,Social sciences,Communication,Society,Communication studies,Humanities,Human activities,Behavior,Information,Semiotics,Mass media
4,Entertainment,Arts,Film,Entertainment occupations,Filmmaking,Film industry,Occupations by type,Arts occupations,Main topic classifications,Artists
5,Beginnings by year,Home video by year,Introductions by time,Art history by medium,Categories by period,Home video,History of film,History of technology,Distribution (marketing),Categories by time
6,Establishments by year,American journalists,Births by decade,Politics of the United States,20th-century births,People,Years,Journalism,American journalism awards,People by status
