country,1,2,3,4,5,6,7,8,9,10
0,Publications by decade of establishment,Newspapers by country,Establishments by year,Newspapers,Newspaper stubs,Newspapers by language,Publications established in the 20th century,Stub categories,Wikipedia maintenance,WikiProject Stub sorting
1,Communications by country,Media by country,Mass media by location,Cultural media,Culture by country,Media in Europe by country,Media in Europe,Communications in Europe by country,Media in Asia,Stubs by region
2,Society,Communication,Social sciences,Communication studies,Behavior,Human activities,Communication by type,Humanities,Public opinion,Information
3,Births by decade,Years,20th-century births,People,Survivors,People by status,Victims,Life,Living people,Nature
4,Categories by city in Canada,Lists of media by city in Canada,Lists by city in Canada,Lists of Canadian media,Canada-related lists,Canada communications-related lists,Lists of media by city,Lists by city,Media in Canada,Lists of media by country
5,Media technology,Digital media,Electronics,Video,Media formats,Information and communications technology,Display technology,Video signal,Imaging,Film and video technology
6,Media companies by year of establishment,Television by year,Media companies by country,Television networks by country,Television by country,Media companies of the United States,Companies by year of establishment,Companies by industry and year of establishment,Television stations by language,Establishments by year and country
